{
  "kind": "identity_review",
  "subtype": "candidate_pair",
  "producer_ref": "3f2b8c1e-9d4a-4b7e-8c21-5a6d7e8f9012",
  "subject_ref": "bluto:candidate/3f2b8c1e-9d4a-4b7e-8c21-5a6d7e8f9012",
  "payload_ref": "bluto:review-evidence/3f2b8c1e-9d4a-4b7e-8c21-5a6d7e8f9012",
  "ruleset_version": "rules-2026.1"
}
